link,title,full_date,print_date,date_info,sort_date,end_date,month,location,town,short_location,postcode,council,council_abbr,location_search,category,info,name,root,event_icon,ppf,update_date
https://cadw.gov.wales/pumpkin-trail,Pumpkin Trail,Mon 30 Oct                             - Tue 31 Oct 2023,Mon 30 Oct - Tue 31 Oct,,2023-10-30,2023-10-31,,Caerleon Roman Fortress and Baths,Caerleon,Caerleon Roman Fortress and Baths,NP18 1AE,Newport,oth,Caerleon Roman Fortress and Baths  NP18 1AE,event,"“Munchkins, come find our pumpkins! ” Pop along to Caerleon Fortress Baths to find our hidden pumpkins       Discover the pumpkins placed around the Baths and bring your completed trail to the welcome desk to collect your treat.",Cadw,https://cadw.gov.wales/ ,./static/images/cadw_logo.png,63,28 Aug 2023 09:58
https://www.nationaltrust.org.uk/visit/wales/dyffryn-gardens/events/2ea11329-2bdb-45ce-bd98-5817e39e710f,Louby Lou's Storytelling – Pumpkin Dash,Mon 30 Oct 2023,Mon 30 Oct *,check event for more dates,2023-10-30,2023-10-30,,"Dyffryn Gardens, St Nicholas, CF5 6SU",Dyffryn Gardens,Dyffryn Gardens,CF5 6SU,Vale of Glamorgan,vog,Dyffryn Gardens  St Nicholas  CF5 6SU,event,"Louby Lou are back at Dyffryn Gardens! A witch has accidentally landed in Dyffryn Gardens, can you help her figure out where she is and how to get back home?",Dyffryn Gardens,https://www.nationaltrust.org.uk,./static/images/national_trust_logo.png,63,28 Aug 2023 09:58
https://www.rctcbc.gov.uk//EN/Events/Archive/2023/October/HalloweenSpooktacular.aspx,Halloween Spooktacular,Monday 30 - Tuesday 31 October 2023,Mon 30 Oct - Tue 31 Oct,,2023-10-30,2023-10-31,,Rhondda Heritage Park,Trehafod,Rhondda Heritage Park,CF37 2NP,Rhondda Cynon Taf,rct,Rhondda Heritage Park  Coedcae Rd  South Wales CF37 2NP,event,"Lots of spooky fun for the kids at A Welsh Coal Mining Experience, Rhondda Heritage Park Museum. More info to be announced soon",Rhondda Cynon Taf,https://www.rctcbc.gov.uk/,./static/images/rct_logo.png,63,28 Aug 2023 09:58
https://cadw.gov.wales/spooky-halloween,Spooky Halloween,Tue 31 Oct 2023,Tue 31 Oct,,2023-10-31,2023-10-31,,Plas Mawr,Cardiff,Plas Mawr,CF5 3JW,Cardiff,cff,Plas Mawr  CF5 3JW,event,Join in the Halloween fun at Plas Mawr! Do you dare to attempt our trail and join in the ghoulish fun?,Cadw,https://cadw.gov.wales/ ,./static/images/cadw_logo.png,64,28 Aug 2023 09:58
https://www.wmc.org.uk/en/whats-on/2023/branwen-dadeni,Branwen: Dadeni,8 – 11 November 2023,Wed 08 Nov – Sat 11 Nov,,2023-11-08,2023-11-11,November,"Wales Millenium Centre, Bute Place, Cardiff, CF10 5AL",Wales Millenium Centre,Wales Millenium Centre,CF10 5AL,Cardiff,cff,Wales Millenium Centre  Bute Place  Cardiff  CF10 5AL,performance,"Donald Gordon Theatre 8 – 11 November 2023 Aberystwyth Arts Centre 15 – 17 November 2023 Pontio, Bangor 22 – 25 November 2023 wait list: 01248 382828",Wales Millenium Centre,https://www.wmc.org.uk,./static/images/wmc_logo.png,72,28 Aug 2023 09:58
http://www.margamcountrypark.co.uk//2128?event_id=38670,The Margam Community Christmas Tree Festival,Sat 11 Nov 2023,Sat 11 Nov - Sun 26 Nov,,2023-11-11,2023-11-11,,"Margam Country Park, Margam, Port Talbot, SA13 2TJ ",Margam Park,Margam Country Park,SA13 2TJ,Neath Port Talbot,oth,Margam Country Park  Margam  Port Talbot  SA13 2TJ ,event,"This special event aims to bring Park groups, community groups, schools, businesses, visitors. .. together making a beautiful festive display for all to enjoy.",Margam Park,http://www.margamcountrypark.co.uk/,./static/images/margam_logo.png,75,28 Aug 2023 09:58
https://www.rctcbc.gov.uk//EN/Events/Archive/2023/November/PontypriddRemembranceSundayParadeandService.aspx,Pontypridd Remembrance Sunday Parade And Service,Sunday 12 November 2023,Sun 12 Nov,,2023-11-12,2023-11-12,,Ynysangharad War Memorial Park,Pontypridd,Ynysangharad War Memorial Park,CF37 4PD,Rhondda Cynon Taf,rct,Ynysangharad War Memorial Park  Pontypridd  CF37 4PD,event,People across Rhondda Cynon Taf are invited to come together and pay their respects to those who made the ultimate sacrifice at the Pontypridd Remembrance Sunday Parade and Service.,Rhondda Cynon Taf,https://www.rctcbc.gov.uk/,./static/images/rct_logo.png,76,28 Aug 2023 09:58
https://www.wmc.org.uk/en/whats-on/2023/sister-act-2023,Sister Act,13 – 18 November 2023,Mon 13 Nov – Sat 18 Nov,,2023-11-13,2023-11-18,,"Wales Millenium Centre, Bute Place, Cardiff, CF10 5AL",Wales Millenium Centre,Wales Millenium Centre,CF10 5AL,Cardiff,cff,Wales Millenium Centre  Bute Place  Cardiff  CF10 5AL,performance,Brace yourselves sisters – the habit is returning to Cardiff after a sell-out 2022 run!,Wales Millenium Centre,https://www.wmc.org.uk,./static/images/wmc_logo.png,77,28 Aug 2023 09:58
https://www.eventbrite.co.uk/e/clive-carroll-plays-the-music-of-john-renbourn-tickets-662351279507,Clive Carroll Plays The Music Of John Renbourn,"Thursday, 16 November",Thu 16 Nov,,2023-11-16,2023-11-16,,"UWC Atlantic College, Llantwit Major, CF61 1WF",St. Donats,St. Donat's Castle,CF61 1WF,Vale of Glamorgan,vog,St. Donat's Castle  UWC Atlantic College  CF61 1WF,event,"Join us for an evening of live music by guitarist Clive Carroll and special guest, Dariush Kanani",UWC Atlantic College,https://www.uwcatlanticexperience.com/ ,./static/images/uwc_logo.png,80,28 Aug 2023 09:58
https://www.cardiffcastle.com/events/cardiffs-winter-wonderland/,Cardiff's Winter Wonderland,16                         Nov                         2023                         -                         02                         Jan                         2024,Thu 16 Nov - Tue 02 Jan 2024,,2023-11-16,2024-01-02,,"The Castle Green, Cardiff Castle, Castle Street, Cardiff, CF10 3RB",Cardiff,The Castle Green,CF10 3RB,Cardiff,cff,The Castle Green  Cardiff Castle  Castle Street  Cardiff  CF10 3RB,event,"EVENT INFO. ..                                         Cardiff's famous and much loved Winter Wonderland. Split once again across two locations in the heart of the city centre, visitors will now be able to experience Cardiff's Winter Wonderland at both Cardiff Castle and City Hall Lawn.           AT CARDIFF CASTLE The Ice Walk This year, Cardiff's Winter Wonderland Ice Rink and Ice Walk will be...",Cardiff Castle,https://www.cardiffcastle.com/ ,./static/images/cardiff_castle_logo.png,80,28 Aug 2023 09:58
https://www.wmc.org.uk/en/whats-on/2023/shrek,Shrek The Musical,20 – 25 November 2023,Mon 20 Nov – Sat 25 Nov,,2023-11-20,2023-11-25,,"Wales Millenium Centre, Bute Place, Cardiff, CF10 5AL",Wales Millenium Centre,Wales Millenium Centre,CF10 5AL,Cardiff,cff,Wales Millenium Centre  Bute Place  Cardiff  CF10 5AL,performance,"Based on the Oscar winning DreamWorks film, the Broadway and West End smash hit Shrek the Musical is a fun filled and hilarious musical comedy with a cast of vibrant characters and a ‘shrektackular' score. Leading our stellar cast as the legendary Shrek is Theatre extraordinaire Antony Lawrence (The Lion King, Mary Poppins, Matilda the Musical, We Will Rock You), Strictly Come Dancing and leading...",Wales Millenium Centre,https://www.wmc.org.uk,./static/images/wmc_logo.png,84,28 Aug 2023 09:58
https://www.rctcbc.gov.uk//EN/Events/Archive/2023/November/Santa'sToyMine.aspx,Santa's Toy Mine,Saturday 25 November - Sunday 24 December 2023,Sat 25 Nov - Sun 24 Dec,,2023-11-25,2023-12-24,,Rhondda Heritage Park,Trehafod,Rhondda Heritage Park,CF37 2NP,Rhondda Cynon Taf,rct,Rhondda Heritage Park  Coedcae Rd  South Wales CF37 2NP,event,"He's back! Santa returns to his toy mine at A Welsh Coal Mining Experience, Rhondda Heritage Park Museum for a whole month!  More info to be announced soon.  Sponsored by Nathaniel Cars",Rhondda Cynon Taf,https://www.rctcbc.gov.uk/,./static/images/rct_logo.png,89,28 Aug 2023 09:58
https://www.wmc.org.uk/en/whats-on/2023/i-should-be-so-lucky,I Should Be So Lucky,27 November – 2 December 2023,Mon 27 Nov – Sat 02 Dec,,2023-11-27,2023-12-02,,"Wales Millenium Centre, Bute Place, Cardiff, CF10 5AL",Wales Millenium Centre,Wales Millenium Centre,CF10 5AL,Cardiff,cff,Wales Millenium Centre  Bute Place  Cardiff  CF10 5AL,performance,"The wedding is OFF, but the honeymoon is ON! It's here. All the hit-factory songs you love - finally on stage in an all-new musical. Head from the aisle to the isles in the official Stock Aitken Waterman musical featuring the soundtrack of a generation with music from pop royalty including Kylie Minogue (I Should Be So Lucky), Rick Astley (Never Gonna Give You Up), Jason Donovan (Especially for...",Wales Millenium Centre,https://www.wmc.org.uk,./static/images/wmc_logo.png,91,28 Aug 2023 09:58
https://www.cardiffcastle.com/events/christmas-welsh-banquet/,Christmas Welsh Banquet,29                             Nov                             2023,Wed 29 Nov - Wed 20 Dec,,2023-11-29,2023-11-29,,Cardiff Castle Castle Street Cardiff CF10 3RB,Cardiff,Cardiff Castle Castle Street Cardiff CF10 3RB,CF10 3RB,Cardiff,cff,Cardiff Castle Castle Street Cardiff CF10 3RB,event,"EVENT INFO. ..                                     It's time for festive feasts and fun in the Castle's vaulted, fifteenth century Undercroft, join us for a very merry Christmas Banquet with traditional Welsh entertainment. For an informal evening of fabulous music and great entertainment, the Castle's traditional Welsh Banquet is a must. With Mead tasting on arrival and a Master of Ceremonies to...",Cardiff Castle,https://www.cardiffcastle.com/ ,./static/images/cardiff_castle_logo.png,93,28 Aug 2023 09:58
https://awenboxoffice.com/whats-on/forage-wreath-workshop-at-bryngarw-house/about,Forage Wreath Workshop At Bryngarw House,Sun 3 Dec 2023,Sun 03 Dec,,2023-12-03,2023-12-03,December,Bryngarw Country Park,Garw Valley,Bryngarw Country Park,CF32 8UU,Bridgend,brd,Bryngarw Country Park  Brynmenyn  Bridgend CF32 8UU,course,"Join us on Sunday 3rd December for a Christmas Wreath Workshop with professional florist, Best Buds by Samara. Head out into the beautiful grounds of Bryngarw Country Park to forage for materials, before heading back to Bryngarw House to make your festive wreath and enjoy a festive grazing platter and a glass of mulled wine or fizz",Bryngarw Country Park ,https://awenboxoffice.com/,./static/images/awen_logo.ico,97,28 Aug 2023 09:58
https://museum.wales//stfagans/whatson/12006/St-Fagans-Ghost-Tours/,St Fagans Ghost Tours,6–8 &  15 December 2023,6 – 8 & 15 Dec,,2023-12-06,2023-12-15,,St Fagans National Museum of History,St. Fagans,St. Fagans,CF5 6XB,Cardiff,cff,St. Fagans  National Museum of History  Cardiff CF5 6XB,event,Explore St Fagans National Museum of History from a completely different angle. Hear true tales of gh. ..,Museum Wales ,https://museum.wales/,./static/images/museum_wales_logo.png,100,28 Aug 2023 09:58
https://www.wmc.org.uk/en/whats-on/2023/disneys-aladdin,Disney's Aladdin,7 December 2023 – 14 January 2024,Thu 07 Dec – Sun 14 Jan 2024,,2023-12-07,2024-01-14,,"Wales Millenium Centre, Bute Place, Cardiff, CF10 5AL",Wales Millenium Centre,Wales Millenium Centre,CF10 5AL,Cardiff,cff,Wales Millenium Centre  Bute Place  Cardiff  CF10 5AL,performance,"Escape to a whole new world and experience this extraordinary theatrical event already seen by over 14 million people worldwide. Featuring the iconic music by Alan Menken, Howard Ashman, and Tim Rice - this exuberant production is filled with unforgettable magic, comedy and breath-taking spectacle! With astonishing special effects, over 350 lavish costumes and a fabulous cast and live orchestra,...",Wales Millenium Centre,https://www.wmc.org.uk,./static/images/wmc_logo.png,101,28 Aug 2023 09:58
https://www.rctcbc.gov.uk//EN/Events/Archive/2023/December/NosGalanRoadRaces.aspx,Nos Galan Road Races,Sunday 31 December 2023,Sun 31 Dec,,2023-12-31,2023-12-31,,Mountain Ash Town Centre,Mountain Ash,Mountain Ash Town Centre,CF45 3AA,Rhondda Cynon Taf,rct,Mountain Ash Town Centre  CF45 3AA,event,The world famous Nos Galan Road Races will be returning to the streets of Mountain Ash on 31st December!   Registration dates and event info will all be released nearer the time. Follow Nos Galan Road Races on Facebook and Twitter for the latest news.,Rhondda Cynon Taf,https://www.rctcbc.gov.uk/,./static/images/rct_logo.png,125,28 Aug 2023 09:58
https://www.wmc.org.uk/en/whats-on/2024/peter-pan-goes-wrong,Peter Pan Goes Wrong,22 – 27 January 2024,Mon 22 Jan 2024 – Sat 27 Jan 2024,,2024-01-22,2024-01-27,January 2024,"Wales Millenium Centre, Bute Place, Cardiff, CF10 5AL",Wales Millenium Centre,Wales Millenium Centre,CF10 5AL,Cardiff,cff,Wales Millenium Centre  Bute Place  Cardiff  CF10 5AL,performance,"The creators of The Play That Goes Wrong return with another catastrophic disaster! Following their multi award-winning sell-out success with The Play That Goes Wrong and the BBC TV series The Goes Wrong Show, Mischief return with their riotous spin on a timeless classic, the West End smash hit Peter Pan Goes Wrong. The members of the Cornley Polytechnic Drama Society are back on stage, battling...",Wales Millenium Centre,https://www.wmc.org.uk,./static/images/wmc_logo.png,147,28 Aug 2023 09:58
https://www.wmc.org.uk/en/whats-on/2024/jesus-christ-superstar,Jesus Christ Superstar,29 January – 3 February 2024,Mon 29 Jan 2024 – Sat 03 Feb 2024,,2024-01-29,2024-02-03,,"Wales Millenium Centre, Bute Place, Cardiff, CF10 5AL",Wales Millenium Centre,Wales Millenium Centre,CF10 5AL,Cardiff,cff,Wales Millenium Centre  Bute Place  Cardiff  CF10 5AL,performance,An album that inspired a revolution. A revelation that changed the world. A reinvention for this millennium.,Wales Millenium Centre,https://www.wmc.org.uk,./static/images/wmc_logo.png,154,28 Aug 2023 09:58
https://www.wmc.org.uk/en/whats-on/2024/bluey,Bluey's Big Play,13 – 17 March 2024,Wed 13 Mar 2024 – Sun 17 Mar 2024,,2024-03-13,2024-03-17,March 2024,"Wales Millenium Centre, Bute Place, Cardiff, CF10 5AL",Wales Millenium Centre,Wales Millenium Centre,CF10 5AL,Cardiff,cff,Wales Millenium Centre  Bute Place  Cardiff  CF10 5AL,performance,"When Dad feels like a little bit of Sunday afternoon time out, Bluey and Bingo have other plans! Join them as they pull out all of the games and cleverness at their disposal to get Dad off that bean bag. Bluey's Big Play is a brand-new theatrical adaptation of the Emmy® award-winning children's television series, with an original story by Bluey creator Joe Brumm, and new music by Bluey composer,...",Wales Millenium Centre,https://www.wmc.org.uk,./static/images/wmc_logo.png,198,28 Aug 2023 09:58
https://www.wmc.org.uk/en/whats-on/2024/edward-scissorhands,Edward Scissorhands,19 – 23 March 2024,Tue 19 Mar 2024 – Sat 23 Mar 2024,,2024-03-19,2024-03-23,,"Wales Millenium Centre, Bute Place, Cardiff, CF10 5AL",Wales Millenium Centre,Wales Millenium Centre,CF10 5AL,Cardiff,cff,Wales Millenium Centre  Bute Place  Cardiff  CF10 5AL,performance,"Matthew Bourne's magical dance production of Edward Scissorhands has carved a place in the hearts of audiences world-wide since its premiere in 2005. Based on the classic Tim Burton movie and featuring the hauntingly beautiful music of Danny Elfman and Terry Davies, Bourne and his New Adventures Company return to this witty, bittersweet story of an incomplete boy left alone in a strange new world.",Wales Millenium Centre,https://www.wmc.org.uk,./static/images/wmc_logo.png,204,28 Aug 2023 09:58
https://www.wmc.org.uk/en/whats-on/2024/bonnie-and-clyde,Bonnie & Clyde,26 – 30 March 2024,Tue 26 Mar 2024 – Sat 30 Mar 2024,,2024-03-26,2024-03-30,,"Wales Millenium Centre, Bute Place, Cardiff, CF10 5AL",Wales Millenium Centre,Wales Millenium Centre,CF10 5AL,Cardiff,cff,Wales Millenium Centre  Bute Place  Cardiff  CF10 5AL,performance,"Ready to raise a little hell?  Winner of Best New Musical (What'sOnStage Awards 2023), the West End smash-hit Bonnie & Clyde is set to hold-up following two hell-raising seasons in London's West End. Two small-town kids from the middle of nowhere became the biggest folk heroes in all America. They craved adventure—and each other. Their names were Bonnie and Clyde. Fearless, shameless, and...",Wales Millenium Centre,https://www.wmc.org.uk,./static/images/wmc_logo.png,211,28 Aug 2023 09:58
https://www.wmc.org.uk/en/whats-on/2024/come-from-away,Come From Away,2 – 6 April 2024,Tue 02 Apr 2024 – Sat 06 Apr 2024,,2024-04-02,2024-04-06,April 2024,"Wales Millenium Centre, Bute Place, Cardiff, CF10 5AL",Wales Millenium Centre,Wales Millenium Centre,CF10 5AL,Cardiff,cff,Wales Millenium Centre  Bute Place  Cardiff  CF10 5AL,performance,"7,000 Stranded Passengers.   One Small Town.   A Remarkable True Story. Winner of four Olivier Awards including Best New Musical in London and the Tony Award for Best Direction of a Musical on Broadway, this smash hit show shares the incredible real-life story of the 7,000 air passengers from all over the world who were grounded in Canada during the wake of 9/11, and the small Newfoundland...",Wales Millenium Centre,https://www.wmc.org.uk,./static/images/wmc_logo.png,218,28 Aug 2023 09:58
https://www.wmc.org.uk/en/whats-on/2024/an-officer-and-a-gentleman,An Officer And A Gentleman,15 – 20 April 2024,Mon 15 Apr 2024 – Sat 20 Apr 2024,,2024-04-15,2024-04-20,,"Wales Millenium Centre, Bute Place, Cardiff, CF10 5AL",Wales Millenium Centre,Wales Millenium Centre,CF10 5AL,Cardiff,cff,Wales Millenium Centre  Bute Place  Cardiff  CF10 5AL,performance,"Prepare to be swept off your feet with An Officer and a Gentleman The Musical, based on the award-winning 80s movie. This timeless story of love, courage, and redemption will make your heart soar and leave you breathless, longing for more. Be part of the emotional journey of Zack Mayo, a fearless young officer candidate, and the captivating Paula Pokrifki, whose fiery spirit matches his own....",Wales Millenium Centre,https://www.wmc.org.uk,./static/images/wmc_logo.png,231,28 Aug 2023 09:58
https://www.insolecourt.org/events/transatlantic-hot-club-live-insole-court,Transatlantic Hot Club Live @ Insole Court,When: 20th April 2024 19:30 - 21:30,Sat 20 Apr 2024,,2024-04-20,2024-04-20,,"Insole Court, Fairwater Road, Llandaff, Cardiff CF5 2LN ",Insole Court,Insole Court,CF5 2LN,Cardiff,cff,Insole Court  Fairwater Road  Llandaff  Cardiff CF5 2LN ,event,The Transatlantic Hot Club will be performing their annual Cardiff concert in the beautiful Drawing Room of Insole Court. Featuring Adrien Chevalier (New York) on Violin and Ben Creighton Griffiths (Cardiff) on Harp joined by an excellent line-up of musicians to be announced nearer the date. For this performance the Hot Club are delighted to be joined by the wonderful Tara Minton on voice! Expect...,Insole Court,https://www.insolecourt.org/,./static/images/insole_court_logo.png,236,28 Aug 2023 09:58
https://www.wmc.org.uk/en/whats-on/2024/pretty-woman,Pretty Woman: The Musical,29 April – 4 May 2024,Mon 29 Apr 2024 – Sat 04 May 2024,,2024-04-29,2024-05-04,,"Wales Millenium Centre, Bute Place, Cardiff, CF10 5AL",Wales Millenium Centre,Wales Millenium Centre,CF10 5AL,Cardiff,cff,Wales Millenium Centre  Bute Place  Cardiff  CF10 5AL,performance,"Big night out. Big. HUGE. Pretty Woman: The Musical is finally embarking on a UK and Ireland tour – so make a date to see Hollywood's ultimate rom-com, live on stage, when this smash-hit musical visits Cardiff in spring 2024. Once upon a time in the late '80s, Vivian met Edward and her life changed forever. Be swept up in their romance in this dazzlingly theatrical take on a love story for the...",Wales Millenium Centre,https://www.wmc.org.uk,./static/images/wmc_logo.png,245,28 Aug 2023 09:58
https://www.wmc.org.uk/en/whats-on/2024/drifters-girl,The Drifters Girl,7 – 11 May 2024,Tue 07 May 2024 – Sat 11 May 2024,,2024-05-07,2024-05-11,May 2024,"Wales Millenium Centre, Bute Place, Cardiff, CF10 5AL",Wales Millenium Centre,Wales Millenium Centre,CF10 5AL,Cardiff,cff,Wales Millenium Centre  Bute Place  Cardiff  CF10 5AL,performance,"Direct from the West End, The Drifters Girl comes to Wales Millennium Centre as part of a major UK & Ireland tour. Nominated for BEST NEW MUSICAL at the 2022 Olivier Awards, this smash-hit show has audiences on their feet night after night with a phenomenal soundtrack packed full of iconic Drifters hits including Saturday Night At The Movies, Save The Last Dance For Me and Stand By Me.",Wales Millenium Centre,https://www.wmc.org.uk,./static/images/wmc_logo.png,253,28 Aug 2023 09:58
https://www.wmc.org.uk/en/whats-on/2024/wizard-of-oz,Wizard Of Oz,23 – 28 July 2024,Tue 23 Jul 2024 – Sun 28 Jul 2024,,2024-07-23,2024-07-28,July 2024,"Wales Millenium Centre, Bute Place, Cardiff, CF10 5AL",Wales Millenium Centre,Wales Millenium Centre,CF10 5AL,Cardiff,cff,Wales Millenium Centre  Bute Place  Cardiff  CF10 5AL,performance,"Direct from The London Palladium, the sensational new production of one of the world's most beloved musicals comes to Cardiff.  Featuring the iconic original score from the Oscar-winning MGM film including Over The Rainbow, Follow The Yellow Brick Road and We're Off To See The Wizard with additional songs from Andrew Lloyd Webber and Tim Rice, this spectacular production of THE WIZARD OF OZ will...",Wales Millenium Centre,https://www.wmc.org.uk,./static/images/wmc_logo.png,330,28 Aug 2023 09:58
https://www.wmc.org.uk/en/whats-on/2024/wicked,Wicked,24 October – 23 November 2024,Thu 24 Oct 2024 – Sat 23 Nov 2024,,2024-10-24,2024-11-23,October 2024,"Wales Millenium Centre, Bute Place, Cardiff, CF10 5AL",Wales Millenium Centre,Wales Millenium Centre,CF10 5AL,Cardiff,cff,Wales Millenium Centre  Bute Place  Cardiff  CF10 5AL,performance,"“One of the most successful musicals of all time” (BBC News), Wicked has been casting its magical spell around the world for two decades. Based on the acclaimed novel by Gregory Maguire, Wicked imagines a beguiling backstory and future possibilities to the lives of L. Frank Baum's beloved characters from ‘The Wonderful Wizard of Oz' and reveals the decisions and events that shape the destinies of...",Wales Millenium Centre,https://www.wmc.org.uk,./static/images/wmc_logo.png,423,28 Aug 2023 09:58
https://www.wmc.org.uk/en/whats-on/2024/hamilton,Hamilton,26 November 2024 – 25 January 2025,Tue 26 Nov 2024 – Sat 25 Jan 2025,,2024-11-26,2025-01-25,November 2024,"Wales Millenium Centre, Bute Place, Cardiff, CF10 5AL",Wales Millenium Centre,Wales Millenium Centre,CF10 5AL,Cardiff,cff,Wales Millenium Centre  Bute Place  Cardiff  CF10 5AL,performance,On sale to Partner and Partner Awen members from 4 SeptemberOn sale to Ffrind and Ffrind+ members from 5 SeptemberOn sale to Groups from 6 SeptemberOn sale to the public from 8 September Sign up for our newsletter to make sure you're the first to find out when tickets go on sale.,Wales Millenium Centre,https://www.wmc.org.uk,./static/images/wmc_logo.png,456,28 Aug 2023 09:58
https://www.insolecourt.org/events/glo-aur-challenge,Glo-Aur Challenge,When: Throughout July 2023,"No date found, please see event details.",,date not found,date not found,date not found,"Insole Court, Fairwater Road, Llandaff, Cardiff CF5 2LN ",Insole Court,Insole Court,CF5 2LN,Cardiff,cff,Insole Court  Fairwater Road  Llandaff  Cardiff CF5 2LN ,event,"We are asking you to take on the challenge, completed however you want, and raise money for Insole Court via sponsorship to help with the restoration and maintenance of Insole Court as a Nationally significant heritage site. You can take on the challenge at any point, there will be a number of participants taking part on the 15th July 2023, as this is the 167th anniversary of the disaster and...",Insole Court,https://www.insolecourt.org/,./static/images/insole_court_logo.png,999,28 Aug 2023 09:58
https://www.eventbrite.co.uk/e/summer-holidays-lido-swimming-tickets-689910058557,Please check event webpage for more info.,ERROR: date not found (tag),date not found,,date not found,date not found,,"UWC Atlantic College, Llantwit Major, CF61 1WF",St. Donats,St. Donat's Castle,CF61 1WF,Vale of Glamorgan,vog,St. Donat's Castle  UWC Atlantic College  CF61 1WF,ERROR: category not found (search),No event information found. Please check event webpage for more details.,UWC Atlantic College,https://www.uwcatlanticexperience.com/ ,./static/images/uwc_logo.png,999,28 Aug 2023 09:58
https://museum.wales//cardiff/whatson/11565/Extra-Time-at-National-Museum-Cardiff/,Extra Time At National Museum Cardiff,Open until 8pm,"No date found, please see event details.",,date not found,date not found,,National Museum Cardiff,Cardiff,National Museum Cardiff,CF10 3NP,Cardiff,cff,National Museum Cardiff  Cardiff CF10 3NP,event,National Museum Cardiff open until 8pm every first Thursday of the month,Museum Wales ,https://museum.wales/,./static/images/museum_wales_logo.png,999,28 Aug 2023 09:58
https://museum.wales//cardiff/whatson/11365/Lilys-Fossil-Footprint/,Lily's Fossil Footprint,,"No date found, please see event details.",,date not found,date not found,,National Museum Cardiff,Cardiff,National Museum Cardiff,CF10 3NP,Cardiff,cff,National Museum Cardiff  Cardiff CF10 3NP,exhibition,"When 4-year-old Lily Wilder went down to a beach in south Wales, she came across something roar-some. ..",Museum Wales ,https://museum.wales/,./static/images/museum_wales_logo.png,999,28 Aug 2023 09:58
