link,title,full_date,print_date,date_info,sort_date,end_date,month,location,town,short_location,postcode,council,council_abbr,location_search,category,info,name,root,event_icon,ppf,update_date
http://www.margamcountrypark.co.uk//2128?event_id=38658,Barrio Fiesta Sa Wales 2023,Sat 08 Jul 2023,Sat 08 Jul - Sun 09 Jul,,2023-07-08,2023-07-08,,"Margam Country Park, Margam, Port Talbot, SA13 2TJ ",Margam Park,Margam Country Park,SA13 2TJ,Neath Port Talbot,oth,Margam Country Park  Margam  Port Talbot  SA13 2TJ ,event,"Barrio Fiesta sa Wales 2023 organized by Filipinos in Wales. Witness our cultural, food, music and dance showcase. It's full of surprises and fun! ! You will enjoy your day😊🎉🎉",Margam Park,http://www.margamcountrypark.co.uk/,./static/images/margam_logo.png,20,18 Jun 2023 21:12
https://www.nationaltrust.org.uk/visit/wales/dyffryn-gardens/events/ad3b19f9-b522-4bde-888b-e9b6c21122ee,Summer Music Nights,Fri 14 Jul 2023,Fri 14 Jul *,check event for more dates,2023-07-14,2023-07-14,,"Dyffryn Gardens, St Nicholas, CF5 6SU",Dyffryn Gardens,Dyffryn Gardens,CF5 6SU,Vale of Glamorgan,vog,Dyffryn Gardens  St Nicholas  CF5 6SU,event,"Our annual event, Summer Music Nights is a programme of musical performances presented in our beautiful grounds.",Dyffryn Gardens,https://www.nationaltrust.org.uk,./static/images/national_trust_logo.png,26,18 Jun 2023 21:12
http://www.margamcountrypark.co.uk//2128?event_id=38659,Step Back In Time With Medieval Knights And Archers From The Lions And Lilies Group,Sat 15 Jul 2023,Sat 15 Jul - Sun 16 Jul,,2023-07-15,2023-07-15,,"Margam Country Park, Margam, Port Talbot, SA13 2TJ ",Margam Park,Margam Country Park,SA13 2TJ,Neath Port Talbot,oth,Margam Country Park  Margam  Port Talbot  SA13 2TJ ,event,"A weekend of archery, combat and sword demonstrations. Ask questions, learn how to handle a pike and try on armour, learn about handicrafts and the food of the era. Great fun day out.",Margam Park,http://www.margamcountrypark.co.uk/,./static/images/margam_logo.png,27,18 Jun 2023 21:12
https://cadw.gov.wales/evening-catherine-aragon,An Evening With Catherine Of Aragon,Sat 15 Jul 2023,Sat 15 Jul,,2023-07-15,2023-07-15,,Raglan Castle,Raglan,Raglan Castle,NP15 2BT,Monmouthshire,oth,Raglan Castle  Castle Rd  Raglan NP15 2BT ,event,"An evening with historian Lesley Smith in the guise of Catherine of Aragon!   Meet Queen Catherine and find out her links to Raglan Castle. Doors open at 7pm, with complimentary Pimms on arrival. Performance begins at  7. 30pm. Evening ticketed event.  Tickets available online via Cadw website, and at site.",Cadw,https://cadw.gov.wales/ ,./static/images/cadw_logo.png,27,18 Jun 2023 21:12
https://www.insolecourt.org/events/diwrnod-treftadaeth-heritage-day,Diwrnod Treftadaeth | Heritage Day,"When: Saturday 15th July 2023, 10am - 4pm",Sat 15 Jul,,2023-07-15,2023-07-15,,"Insole Court, Fairwater Road, Llandaff, Cardiff CF5 2LN ",Insole Court,Insole Court,CF5 2LN,Cardiff,cff,Insole Court  Fairwater Road  Llandaff  Cardiff CF5 2LN ,event,Glo Aur Walk  Sponsorship Form,Insole Court,https://www.insolecourt.org/,./static/images/insole_court_logo.png,27,18 Jun 2023 21:12
https://museum.wales//swansea/whatson/11880/Come-to-Sing/,Come To Sing!,"15 July 2023, 11am",Sat 15 Jul - Sat 16 Sep,,2023-07-15,2023-07-15,,National Waterfront Museum,Swansea,National Waterfront Museum,SA1 3RD ,Swansea,swa,National Waterfront Museum  Oystermouth Rd  Maritime Quarter  Swansea SA1 3RD ,event,A warm welcome to Welsh speakers and learners to join musician Delyth Jenkins and learn Welsh throug. ..,Museum Wales ,https://museum.wales/,./static/images/museum_wales_logo.png,27,18 Jun 2023 21:12
https://cadw.gov.wales/tudor-and-elizabethan-weekend,Tudor And Elizabethan Weekend,Sat 15 Jul                             - Sun 16 Jul 2023,Sat 15 Jul - Sun 16 Jul,,2023-07-15,2023-07-16,,Raglan Castle,Raglan,Raglan Castle,NP15 2BT,Monmouthshire,oth,Raglan Castle  Castle Rd  Raglan NP15 2BT ,event,"Raglan Castle commemorates the 400th anniversary of the composer, William Byrd, with living history, choirs and talks.   How to visit •    purchase your admission tickets on arrival (or book online)* •    check event times and prices below",Cadw,https://cadw.gov.wales/ ,./static/images/cadw_logo.png,27,18 Jun 2023 21:12
https://museum.wales//swansea/whatson/10716/Teddy-Bears-Picnic/,Teddy Bear's Picnic,"19 July 2023, 10:30am - 2:30pm",Wed 19 Jul,,2023-07-19,2023-07-19,,National Waterfront Museum,Swansea,National Waterfront Museum,SA1 3RD ,Swansea,swa,National Waterfront Museum  Oystermouth Rd  Maritime Quarter  Swansea SA1 3RD ,event,If you go down the Museum today you're sure for a big surprise…Join us for a fantastic . ..,Museum Wales ,https://museum.wales/,./static/images/museum_wales_logo.png,31,18 Jun 2023 21:12
https://www.insolecourt.org/events/summer-jazz-keith-little-jazz-trio,Summer Jazz - Keith Little Jazz Trio,"When: Thursday 20th July, 6.00pm & 7:30pm",Thu 20 Jul,,2023-07-20,2023-07-20,,"Insole Court, Fairwater Road, Llandaff, Cardiff CF5 2LN ",Insole Court,Insole Court,CF5 2LN,Cardiff,cff,Insole Court  Fairwater Road  Llandaff  Cardiff CF5 2LN ,event,Two Sittings:6:00pm https://www. ticketsource. co. uk. .. 7:30pm https://www. ticketsource. co. uk. ..,Insole Court,https://www.insolecourt.org/,./static/images/insole_court_logo.png,32,18 Jun 2023 21:12
https://museum.wales//swansea/whatson/11566/Extra-Time-at-the-National-Waterfront-Museum/,Extra Time At The National Waterfront Museum,"20, 27 July, 3, 10, 17, 24, 31 August &  7 September 2023","20, 27 Jul, 3, 10, 17, 24, 31 Aug & 7 Sep",,2023-07-20,2023-09-07,,National Waterfront Museum,Swansea,National Waterfront Museum,SA1 3RD ,Swansea,swa,National Waterfront Museum  Oystermouth Rd  Maritime Quarter  Swansea SA1 3RD ,event,Come enjoy and explore the National Waterfront Museum during our extended opening hours every Thursd. ..,Museum Wales ,https://museum.wales/,./static/images/museum_wales_logo.png,32,18 Jun 2023 21:12
https://www.cardiffcastle.com/events/tom-jones/,Tom Jones,21                             Jul                             2023,Fri 21 Jul,,2023-07-21,2023-07-21,,"The Castle Green, Cardiff Castle, Castle Street, Cardiff, CF10 3RB",Cardiff,The Castle Green,CF10 3RB,Cardiff,cff,The Castle Green  Cardiff Castle  Castle Street  Cardiff  CF10 3RB,event,"Tom Jones is playing live at Cardiff Castle on Friday 21 July 2023, tickets on general sale from Friday 10 February @ 10:00.",Cardiff Castle,https://www.cardiffcastle.com/ ,./static/images/cardiff_castle_logo.png,33,18 Jun 2023 21:12
https://cadw.gov.wales/jester-school,Jester School,Sat 22 Jul                             - Sun 23 Jul 2023,Sat 22 Jul - Sun 23 Jul,,2023-07-22,2023-07-23,,Chepstow Castle,Chepstow,Chepstow Castle,NP16 5EY,Monmouthshire,oth,Chepstow Castle  Bridge St  Chepstow NP16 5EY ,event,"Visit Chepstow Castle this weekend and see if you have what it takes to be a medieval jester! From juggling and diablo, to plate spinning and tightrope walking, our resident jester Juggling Jim will be on-hand to teach you the skills needed to entertain a medieval lord and lady, plus their distinguished guests!",Cadw,https://cadw.gov.wales/ ,./static/images/cadw_logo.png,34,18 Jun 2023 21:12
https://www.nationaltrust.org.uk/visit/wales/dyffryn-gardens/events/8e2883a4-73cc-497e-890f-d7913c963d40,Summer Of Play,Sat 22 Jul 2023,Sat 22 Jul *,check event for more dates,2023-07-22,2023-07-22,,"Dyffryn Gardens, St Nicholas, CF5 6SU",Dyffryn Gardens,Dyffryn Gardens,CF5 6SU,Vale of Glamorgan,vog,Dyffryn Gardens  St Nicholas  CF5 6SU,event,The gardens at Dyffryn will be filled with music and play this summer holidays.,Dyffryn Gardens,https://www.nationaltrust.org.uk,./static/images/national_trust_logo.png,34,18 Jun 2023 21:12
https://www.nationaltrust.org.uk/visit/wales/tredegar-house/events/ec4f9d33-8f57-4c85-a0dd-6e70d2cb432f,Summer Of Play,Sat 22 Jul 2023,Sat 22 Jul *,check event for more dates,2023-07-22,2023-07-22,,"Tredegar House, Pencarn Way, Newport, NP10 8YW ",Tredegar House,Tredegar House,NP10 8YW,Newport,oth,Tredegar House  Pencarn Way  Newport  NP10 8YW ,event,Experience a summer of play during school holidays with games in the gardens.,Tredegar House,https://www.nationaltrust.org.uk,./static/images/national_trust_logo.png,34,18 Jun 2023 21:12
https://cadw.gov.wales/summer-trail,Summer Trail,Sat 22 Jul                             - Thu 31 Aug 2023,Sat 22 Jul - Thu 31 Aug,,2023-07-22,2023-08-31,,Caerleon Roman Fortress and Baths,Caerleon,Caerleon Roman Fortress and Baths,NP18 1AE,Newport,oth,Caerleon Roman Fortress and Baths  NP18 1AE,event,"Come and take part in our Roman Baths Treasure Hunt! Personal valuables often went missing during a visit to the Baths, leaving a treasure trove of unusual objects, hidden for almost 2000 years.   Explore the Baths and find the lost treasures!   How to visit",Cadw,https://cadw.gov.wales/ ,./static/images/cadw_logo.png,34,18 Jun 2023 21:12
http://www.margamcountrypark.co.uk//2128?event_id=38660,Summer Pruning,Sat 22 Jul 2023,Sat 22 Jul,,2023-07-22,2023-07-22,,"Margam Country Park, Margam, Port Talbot, SA13 2TJ ",Margam Park,Margam Country Park,SA13 2TJ,Neath Port Talbot,oth,Margam Country Park  Margam  Port Talbot  SA13 2TJ ,event,"Join in with the summer pruning of the espalier pear trees in the Community Orchard. Includes hands on, practical demonstrations. 10am-12pm and 1pm-3pm. Booking is essential. Free, parking charges apply.",Margam Park,http://www.margamcountrypark.co.uk/,./static/images/margam_logo.png,34,18 Jun 2023 21:12
https://museum.wales//swansea/whatson/11891/Quiet-Hour-at-the-Museum/,Quiet Hour At The Museum,"23 July, 27 August &  24 September 2023, 3-4pm","23 Jul, 27 Aug & 24 Sep, 3",,2023-07-23,2023-09-03,,National Waterfront Museum,Swansea,National Waterfront Museum,SA1 3RD ,Swansea,swa,National Waterfront Museum  Oystermouth Rd  Maritime Quarter  Swansea SA1 3RD ,event,Public spaces can be overwhelming and very stressful for individuals with additional needs and disab. ..,Museum Wales ,https://museum.wales/,./static/images/museum_wales_logo.png,35,18 Jun 2023 21:12
http://www.margamcountrypark.co.uk//2128?event_id=38445,"Family Fun Day With Paw Patrol, Paddington Bear & More…",Sun 23 Jul 2023,Sun 23 Jul,,2023-07-23,2023-07-23,,"Margam Country Park, Margam, Port Talbot, SA13 2TJ ",Margam Park,Margam Country Park,SA13 2TJ,Neath Port Talbot,oth,Margam Country Park  Margam  Port Talbot  SA13 2TJ ,event,"Summer Family Fun Day featuring Paw Patrol, Paddington Bear, Titan the Robot and more….",Margam Park,http://www.margamcountrypark.co.uk/,./static/images/margam_logo.png,35,18 Jun 2023 21:12
https://www.eventbrite.co.uk/e/open-days-at-st-donats-castle-sunday-23rd-july-tickets-598493017727,Open Days At St Donat's Castle | Sunday 23Rd July,Jul 23,Sun 23 Jul,,2023-07-23,2023-07-23,,"UWC Atlantic College St Donat's Castle, Saint Donats, CF61 1WF",St. Donats,St. Donat's Castle,CF61 1WF,Vale of Glamorgan,vog,St. Donat's Castle  UWC Atlantic College  CF61 1WF,event,St Donat's Castle is excited to open its gates on selected Sundays throughout the school holidays,UWC Atlantic College,https://www.uwcatlanticexperience.com/ ,./static/images/uwc_logo.png,35,18 Jun 2023 21:12
http://www.margamcountrypark.co.uk//2128?event_id=39754,Its A Bugs Life,Mon 24 Jul 2023,Mon 24 Jul,,2023-07-24,2023-07-24,,"Margam Country Park, Margam, Port Talbot, SA13 2TJ ",Margam Park,Margam Country Park,SA13 2TJ,Neath Port Talbot,oth,Margam Country Park  Margam  Port Talbot  SA13 2TJ ,course,"Craft Activities with the Friends of Margam Park. Pipe cleaner dragonflies, dot to dot butterflies…all things buggy! !! !",Margam Park,http://www.margamcountrypark.co.uk/,./static/images/margam_logo.png,36,18 Jun 2023 21:12
https://cadw.gov.wales/lets-discover-medieval-weapons,Let's Discover… Medieval Weapons,Tue 25 Jul 2023,Tue 25 Jul,,2023-07-25,2023-07-25,,Chepstow Castle,Chepstow,Chepstow Castle,NP16 5EY,Monmouthshire,oth,Chepstow Castle  Bridge St  Chepstow NP16 5EY ,event,"Come and be entertained by our resident knight, and get a close-up look at medieval weaponry!   Talks and demonstrations throughout the day. Everything you wanted to know but were too afraid to ask!   How to visit •    purchase your admission tickets on arrival (or book online)* •    check event times and prices below",Cadw,https://cadw.gov.wales/ ,./static/images/cadw_logo.png,37,18 Jun 2023 21:12
http://www.margamcountrypark.co.uk//2128?event_id=39755,Celtic Leisure,Tue 25 Jul 2023,Tue 25 Jul - Thu 31 Aug,,2023-07-25,2023-07-25,,"Margam Country Park, Margam, Port Talbot, SA13 2TJ ",Margam Park,Margam Country Park,SA13 2TJ,Neath Port Talbot,oth,Margam Country Park  Margam  Port Talbot  SA13 2TJ ,event,"We have some great goodies, lots of information and games for all ages. We can't wait to see you in the sunshine!",Margam Park,http://www.margamcountrypark.co.uk/,./static/images/margam_logo.png,37,18 Jun 2023 21:12
http://www.margamcountrypark.co.uk//2128?event_id=39757,Kidzfun –Create Your Own Wildlife Inspired Pottery,Tue 25 Jul 2023,Tue 25 Jul,,2023-07-25,2023-07-25,,"Margam Country Park, Margam, Port Talbot, SA13 2TJ ",Margam Park,Margam Country Park,SA13 2TJ,Neath Port Talbot,oth,Margam Country Park  Margam  Port Talbot  SA13 2TJ ,event,"include designs with ducks, owls.  You name it let's paint it!",Margam Park,http://www.margamcountrypark.co.uk/,./static/images/margam_logo.png,37,18 Jun 2023 21:12
http://www.margamcountrypark.co.uk//2128?event_id=39756,Have A Go At Archery,Tue 25 Jul 2023,Tue 25 Jul - Wed 30 Aug,,2023-07-25,2023-07-25,,"Margam Country Park, Margam, Port Talbot, SA13 2TJ ",Margam Park,Margam Country Park,SA13 2TJ,Neath Port Talbot,oth,Margam Country Park  Margam  Port Talbot  SA13 2TJ ,event,Margam Archery Club. 3 arrows £1.,Margam Park,http://www.margamcountrypark.co.uk/,./static/images/margam_logo.png,37,18 Jun 2023 21:12
https://cadw.gov.wales/lets-discover-photography,Let's Discover ... Photography,Wed 26 Jul 2023,Wed 26 Jul,,2023-07-26,2023-07-26,,Chepstow Castle,Chepstow,Chepstow Castle,NP16 5EY,Monmouthshire,oth,Chepstow Castle  Bridge St  Chepstow NP16 5EY ,event,"Visit Chepstow Castle and learn how to take great photos! The development of smartphones means many of us have a good quality camera with us wherever we go. Members of the Forest of Dean Camera Club will be on-hand to pass on their expert knowledge on what makes a great photo, and help you extract the most from the camera in your pocket.",Cadw,https://cadw.gov.wales/ ,./static/images/cadw_logo.png,38,18 Jun 2023 21:12
http://www.margamcountrypark.co.uk//2128?event_id=39758,Kidzfun,Wed 26 Jul 2023,Wed 26 Jul - Tue 29 Aug,,2023-07-26,2023-07-26,,"Margam Country Park, Margam, Port Talbot, SA13 2TJ ",Margam Park,Margam Country Park,SA13 2TJ,Neath Port Talbot,oth,Margam Country Park  Margam  Port Talbot  SA13 2TJ ,event,create your own sea life sand picture or make a sea life sand bottle,Margam Park,http://www.margamcountrypark.co.uk/,./static/images/margam_logo.png,38,18 Jun 2023 21:12
http://www.margamcountrypark.co.uk//2128?event_id=39759,Have A Go At Archery With The Margam Archery Club,Wed 26 Jul 2023,Wed 26 Jul,,2023-07-26,2023-07-26,,"Margam Country Park, Margam, Port Talbot, SA13 2TJ ",Margam Park,Margam Country Park,SA13 2TJ,Neath Port Talbot,oth,Margam Country Park  Margam  Port Talbot  SA13 2TJ ,event,3 arrows £1. Meet at the BBQ site at the rear of the Castle. 11am-3pm,Margam Park,http://www.margamcountrypark.co.uk/,./static/images/margam_logo.png,38,18 Jun 2023 21:12
https://cadw.gov.wales/falconry-days,Falconry Days,Wed 26 Jul 2023,Wed 26 Jul,,2023-07-26,2023-07-26,,Raglan Castle,Raglan,Raglan Castle,NP15 2BT,Monmouthshire,oth,Raglan Castle  Castle Rd  Raglan NP15 2BT ,event,Wings of Wales join us again with their birds of prey! Come and meet the birds and enjoy their flying displays.   You do not need to book tickets for this event.,Cadw,https://cadw.gov.wales/ ,./static/images/cadw_logo.png,38,18 Jun 2023 21:12
https://museum.wales//bigpit/whatson/11957/Festival-of-Archaeology-Big-Pit-/,Festival Of Archaeology: Big Pit,"27 & 28 July 2023, 10am - 4pm",Thu 27 Jul & Fri 28 Jul,,2023-07-27,2023-07-28,,Big Pit National Coal Museum,Blaenavon,Big Pit,NP4 9XP,Torfaen,oth,Big Pit  National Coal Museum  Pontypool NP4 9XP,event,Explore the history of Big Pit and the Welsh Valleys in this family-friendly day. Come along to explo. ..,Museum Wales ,https://museum.wales/,./static/images/museum_wales_logo.png,39,18 Jun 2023 21:12
http://www.margamcountrypark.co.uk//2128?event_id=39760,Pop Up Stories With Louby Lou's Interactive Storytelling –Jack & The Beanstalk,Thu 27 Jul 2023,Thu 27 Jul,,2023-07-27,2023-07-27,,"Margam Country Park, Margam, Port Talbot, SA13 2TJ ",Margam Park,Margam Country Park,SA13 2TJ,Neath Port Talbot,oth,Margam Country Park  Margam  Port Talbot  SA13 2TJ ,event,"Fee Fie Foe Fum! Beanstalks, golden eggs and a cheeky boy named Jack await you in this storytelling adventure. Suitable for 3 – 8 years old accompanied by an adult.",Margam Park,http://www.margamcountrypark.co.uk/,./static/images/margam_logo.png,39,18 Jun 2023 21:12
http://www.margamcountrypark.co.uk//2128?event_id=39761,Beach Day With The Friends Of Margam Park,Fri 28 Jul 2023,Fri 28 Jul,,2023-07-28,2023-07-28,,"Margam Country Park, Margam, Port Talbot, SA13 2TJ ",Margam Park,Margam Country Park,SA13 2TJ,Neath Port Talbot,oth,Margam Country Park  Margam  Port Talbot  SA13 2TJ ,event,"Beach Day with the Friends of Margam Park Whats below the waves? Make a beach scene, what might you spot on your local beach?",Margam Park,http://www.margamcountrypark.co.uk/,./static/images/margam_logo.png,40,18 Jun 2023 21:12
https://www.visitthevale.com/events/FonmonCastleMedievalWeekendatFonmonCastleCParkGardens,"Fonmon Castle Medieval Weekend 2023 At Fonmon Castle, Park & Gardens","July 28, 2023/July 29, 2023",Fri 28 Jul - Sat 29 Jul,,2023-07-28,2023-07-29,,"Fonmon, Barry, Vale of Glamorgan, CF62 3ZN",Fonmon ,Fonmon,CF62 3ZN,Vale of Glamorgan,vog,Fonmon  Barry  Vale of Glamorgan  CF62 3ZN,event,Attention all Sword thrill-seekers and history buffs! Join us at Fonmon Castle for a one-of-a-kind Foot Combat event that will transport you back in time to the Medieval Era.,Visit the Vale,https://www.visitthevale.com,./static/images/visit_the_vale_logo.png,40,18 Jun 2023 21:12
https://www.visitthevale.com/events/glastonbarry-2023,Glastonbarry 2023,"July 29, 2023/July 30, 2023",Sat 29 Jul - Sun 30 Jul,,2023-07-29,2023-07-30,,Barry & Barry Island,Barry,Barry Promenade,CF62 5TQ,Vale of Glamorgan,vog,Barry Promenade  CF62 5TQ,event,"GlastonBARRY Tribute Festival returns to Barry this July, to celebrate its 10th year anniversary!",Visit the Vale,https://www.visitthevale.com,./static/images/visit_the_vale_logo.png,41,18 Jun 2023 21:12
https://museum.wales//roman/whatson/11948/Festival-of-Archaeology-National-Roman-Legion-Museum--Fire/,Festival Of Archaeology: National Roman Legion Museum – Fire,"29 & 30 July 2023, 10am - 4pm",Sat 29 Jul & Sun 30 Jul,,2023-07-29,2023-07-30,,National Roman Legion Museum,Caerleon,National Roman Legion Museum,NP18 1AE,Newport,oth,National Roman Legion Museum  High St  Caerleon  Newport NP18 1AE,event,Come along to our camp to find out why fire was so important to the Romans. We'll have the sou. ..,Museum Wales ,https://museum.wales/,./static/images/museum_wales_logo.png,41,18 Jun 2023 21:12
https://cadw.gov.wales/excavating-medieval-castell-coch-a-victorian-expedition,Excavating Medieval Castell Coch: A Victorian Expedition,Sat 29 Jul                             - Sun 30 Jul 2023,Sat 29 Jul - Sun 30 Jul,,2023-07-29,2023-07-30,,Castell Coch,Cardiff,Castell Coch,CF15 7JS,Cardiff,cff,Castell Coch  Cardiff CF15 7JS ,event,"Castell Coch is a Victorian rebuild in its upper levels, whilst being on Medieval lower levels and foundations. Before this re-build took place a series of archaeological excavations were conducted by a G. T. Clark, whose work was published in 1850. Join us in reconstructing the Victorian excavations here of the 1800s. Uncover with your own hands a range of Medieval treasures, try and guess what...",Cadw,https://cadw.gov.wales/ ,./static/images/cadw_logo.png,41,18 Jun 2023 21:12
http://www.margamcountrypark.co.uk//2128?event_id=39762,Meet Your Local Coastguard Rescue Team,Sun 30 Jul 2023,Sun 30 Jul,,2023-07-30,2023-07-30,,"Margam Country Park, Margam, Port Talbot, SA13 2TJ ",Margam Park,Margam Country Park,SA13 2TJ,Neath Port Talbot,oth,Margam Country Park  Margam  Port Talbot  SA13 2TJ ,event,"Come along and meet the team- find out what we do. You can learn about staying safe on the coast, see our equipment, try your hand at throwing a lifeline and even step inside our portable command centre. We will also be answering questions about how you can join us as a volunteer!",Margam Park,http://www.margamcountrypark.co.uk/,./static/images/margam_logo.png,42,18 Jun 2023 21:12
http://www.margamcountrypark.co.uk//2128?event_id=39763,Wildlife Mask Day With The Friends Of Margam Park.,Mon 31 Jul 2023,Mon 31 Jul,,2023-07-31,2023-07-31,,"Margam Country Park, Margam, Port Talbot, SA13 2TJ ",Margam Park,Margam Country Park,SA13 2TJ,Neath Port Talbot,oth,Margam Country Park  Margam  Port Talbot  SA13 2TJ ,event,Pop along and make a mask of one of the animals that live in the Park…. Let your imagination run WILD!,Margam Park,http://www.margamcountrypark.co.uk/,./static/images/margam_logo.png,43,18 Jun 2023 21:12
https://museum.wales//stfagans/whatson/11893/Bat-Walks/,Bat Walks,31 July–24 August 2023,Mon 31 Jul – Thu 24 Aug,,2023-07-31,2023-08-24,,St Fagans National Museum of History,St. Fagans,St. Fagans,CF5 6XB,Cardiff,cff,St. Fagans  National Museum of History  Cardiff CF5 6XB,event,"If you're a bat fan, then come along to St Fagans after-dark where we'll go looking for . ..",Museum Wales ,https://museum.wales/,./static/images/museum_wales_logo.png,43,18 Jun 2023 21:12
http://www.margamcountrypark.co.uk//2128?event_id=39746,Wizarding Workshop,Tue 01 Aug 2023,Tue 01 Aug,,2023-08-01,2023-08-01,August,"Margam Country Park, Margam, Port Talbot, SA13 2TJ ",Margam Park,Margam Country Park,SA13 2TJ,Neath Port Talbot,oth,Margam Country Park  Margam  Port Talbot  SA13 2TJ ,course,"Wizarding Workshop 100% hands on activity. Lots of make and takes. Free parking with every ticket purchased, just show your ticket at the entrance gate. Suitable for 4+ yrs. Parents stay with their children and are welcome to try out the experiments too. Lab coats and safety goggles will be provided. Tickets are limited to 40 per session and are selling fast, grab yours NOW at https://bookwhen....",Margam Park,http://www.margamcountrypark.co.uk/,./static/images/margam_logo.png,44,18 Jun 2023 21:12
https://cadw.gov.wales/lets-discoverthe-printed-word,Let's Discover…The Printed Word,Tue 01 Aug 2023,Tue 01 Aug,,2023-08-01,2023-08-01,,Chepstow Castle,Chepstow,Chepstow Castle,NP16 5EY,Monmouthshire,oth,Chepstow Castle  Bridge St  Chepstow NP16 5EY ,event,"Printer Francesca Kay demonstrates how to set type and print the old fashioned way. Francesca will make you a letterpress  print with her vintage table top printing press, explaining how this ancient skill changed the world. She will also tell you how some of our common phrases come from the letterpress printing world. Come and find out how to make a good impression!",Cadw,https://cadw.gov.wales/ ,./static/images/cadw_logo.png,44,18 Jun 2023 21:12
https://museum.wales//roman/whatson/11955/Gladiators/,Gladiators,"2, 9, 16, 23 &  30 August 2023, 10.30-11.30am,12-1pm, 1.30-2.30pm & 3-4pm.","2, 9, 16, 23 & 30 Aug, 12",,2023-08-02,2023-08-12,,National Roman Legion Museum,Caerleon,National Roman Legion Museum,NP18 1AE,Newport,oth,National Roman Legion Museum  High St  Caerleon  Newport NP18 1AE,event,2000 years ago Gladiators were some of the biggest sports stars in the Roman Empire.   They were. ..,Museum Wales ,https://museum.wales/,./static/images/museum_wales_logo.png,45,18 Jun 2023 21:12
https://cadw.gov.wales/make-and-take,Make And Take,Wed 02 Aug 2023,Wed 02 Aug,,2023-08-02,2023-08-02,,Chepstow Castle,Chepstow,Chepstow Castle,NP16 5EY,Monmouthshire,oth,Chepstow Castle  Bridge St  Chepstow NP16 5EY ,course,"Get crafty at Chepstow Castle during the summer holidays! Children can make something to play with in the castle and then take home. Drop-in sessions, no need to book.",Cadw,https://cadw.gov.wales/ ,./static/images/cadw_logo.png,45,18 Jun 2023 21:12
https://museum.wales//swansea/whatson/11562/National-Play-Day---Quiet-Hour/,National Play Day - Quiet Hour,"2 August 2023, 10am - 11am",Wed 02 Aug,,2023-08-02,2023-08-02,,National Waterfront Museum,Swansea,National Waterfront Museum,SA1 3RD ,Swansea,swa,National Waterfront Museum  Oystermouth Rd  Maritime Quarter  Swansea SA1 3RD ,event,"A chance to celebrate National Play Day aimed at children who enjoy a calmer, quieter time with less. ..",Museum Wales ,https://museum.wales/,./static/images/museum_wales_logo.png,45,18 Jun 2023 21:12
https://museum.wales//swansea/whatson/11951/National-Play-Day/,National Play Day,"2 August 2023, 11am - 2pm",Wed 02 Aug,,2023-08-02,2023-08-02,,National Waterfront Museum,Swansea,National Waterfront Museum,SA1 3RD ,Swansea,swa,National Waterfront Museum  Oystermouth Rd  Maritime Quarter  Swansea SA1 3RD ,event,Help us raise the roof at the Museum this National Play Day! Featuring:- Circus skills and games by C. ..,Museum Wales ,https://museum.wales/,./static/images/museum_wales_logo.png,45,18 Jun 2023 21:12
