link,title,full_date,print_date,date_info,sort_date,end_date,month,location,town,short_location,postcode,council,council_abbr,location_search,category,info,name,root,event_icon,ppf,update_date
https://www.cardiffcastle.com/events/fisher/,Fisher,10                             Jun                             2023,Sat 10 Jun,,2023-06-10,2023-06-10,,"The Castle Green, Cardiff Castle, Castle Street, Cardiff, CF10 3RB",Cardiff,The Castle Green,CF10 3RB,Cardiff,cff,The Castle Green  Cardiff Castle  Castle Street  Cardiff  CF10 3RB,event,"Fisher is playing live at Cardiff Castle on Saturday 10 June 2023, tickets on general sale from Friday 27 January @ 10:00.",Cardiff Castle,https://www.cardiffcastle.com/ ,./static/images/cardiff_castle_logo.png,97,05 Mar 2023 00:30
https://cadw.gov.wales/wellbeing-day,Wellbeing Day,Sun 11 Jun 2023,Sun 11 Jun,,2023-06-11,2023-06-11,,Tretower Court and Castle,Llanfihangel Cwmdu with Bwlch and Cathedine,Tretower Court and Castle,NP8 1RF,Powys,out,Tretower Court and Castle  Powys  Tretower  Crickhowell NP8 1RF,event,"Escape the business and stress of everyday life, and come to Tretower's Wellbeing Day for the chance to relax and unwind. Spend time in the peaceful atmosphere of the beautiful medieval house and grounds, and take the opportunity to participate in some of the classes on offer during the day.",Cadw,https://cadw.gov.wales/ ,./static/images/cadw_logo.png,98,05 Mar 2023 00:30
https://cadw.gov.wales/some-tunes-and-tales-mair-tomos-ifans,Some Tunes And Tales With Mair Tomos Ifans,Thu 15 Jun 2023,Thu 15 Jun,,2023-06-15,2023-06-15,,Criccieth Castle,Criccieth,Criccieth Castle,LL52 0DP,Gwynedd,out,Criccieth Castle  LL52 0DP,event,"Traditional Welsh legends, myths and tales, illustrated with folk songs and airs played on a small lap harp and also on the Welsh triple harp.  Come and listen — or come for a chat about old legends and stories and songs.   How to visit",Cadw,https://cadw.gov.wales/ ,./static/images/cadw_logo.png,102,05 Mar 2023 00:30
https://www.cardiffcastle.com/events/blondie/,Blondie,16                             Jun                             2023,Fri 16 Jun,,2023-06-16,2023-06-16,,"The Castle Green, Cardiff Castle, Castle Street, Cardiff, CF10 3RB",Cardiff,The Castle Green,CF10 3RB,Cardiff,cff,The Castle Green  Cardiff Castle  Castle Street  Cardiff  CF10 3RB,event,"Blondie are playing live at Cardiff Castle on Fri 16 June 2023, tickets on sale from Fri 2 Dec @ 09:00. Presented by DEPOT Live.",Cardiff Castle,https://www.cardiffcastle.com/ ,./static/images/cardiff_castle_logo.png,103,05 Mar 2023 00:30
https://www.cardiffcastle.com/events/pride-cymru/,Pride Cymru,17                         Jun                         2023                         -                         18                         Jun                         2023,Sat 17 Jun - Sun 18 Jun,,2023-06-17,2023-06-18,,"Cardiff Castle, Castle Street, Cardiff CF10 3RB",Cardiff,Cardiff Castle,CF10 3RB,Cardiff,cff,Cardiff Castle  Castle Street  Cardiff CF10 3RB,event,"Pride Cymru is excited to host Wales’ biggest celebration of equality and diversity at Cardiff Castle for the first time! Over the 17th and 18th June 2023, the Castle will welcome thousands to Cardiff to celebrate with an exciting programme of fantastic performers, an iconic parade and a fabulous community market. ",Cardiff Castle,https://www.cardiffcastle.com/ ,./static/images/cardiff_castle_logo.png,104,05 Mar 2023 00:30
https://cadw.gov.wales/medieval-falconry,Medieval Falconry,Sat 17 Jun                             - Sun 18 Jun 2023,Sat 17 Jun - Sun 18 Jun,,2023-06-17,2023-06-18,,Chepstow Castle,Chepstow,Chepstow Castle,NP16 5EY,Monmouthshire,oth,Chepstow Castle  Bridge St  Chepstow NP16 5EY ,event,Get up close and personal with a variety of birds-of-prey this weekend at Chepstow Castle! Find out about these fabulous birds and their role in medieval falconry. There will also be opportunities for supervised handling and photos.* *Please note that there will be an extra charge for this.,Cadw,https://cadw.gov.wales/ ,./static/images/cadw_logo.png,104,05 Mar 2023 00:30
https://cadw.gov.wales/family-fun-dog-show,Family Fun Dog Show,Sun 18 Jun 2023,Sun 18 Jun,,2023-06-18,2023-06-18,,Denbigh Castle,Denbigh,Denbigh Castle,LL16 3NB,Denbighshire,out,Denbigh Castle  LL16 3NB,event,Join us this Father's Day for the annual Denbigh Castle Family Fun Dog Show! This friendly family-orientated dog show has numerous categories suitable for everyone.  Will you win the ‘Scruffiest Mutt' rosette? Come and join us and expect a day full of fun and laughter for all the family. Registration opens at 11am. First category begins 12.30pm. Cost per category - £1 (Dogs may be entered in multiple categories). Normal castle admission also applies.,Cadw,https://cadw.gov.wales/ ,./static/images/cadw_logo.png,105,05 Mar 2023 00:30
http://www.margamcountrypark.co.uk//2128?event_id=38656,Dragon Ride,Sun 18 Jun 2023,Sun 18 Jun,,2023-06-18,2023-06-18,,"Margam Country Park, Margam, Port Talbot, SA13 2TJ ",Margam,Margam Country Park,SA13 2TJ,Neath Port Talbot,oth,Margam Country Park  Margam  Port Talbot  SA13 2TJ ,event,"The UK's most prestigious Sportive, a non-competitive Cycling marathon held over a mountainous course using public Roads in South Wales and the Brecon Beacons.",Margam Park,http://www.margamcountrypark.co.uk/,./static/images/margam_logo.png,105,05 Mar 2023 00:30
https://www.wmc.org.uk/en/whats-on/2023/welsh-national-opera-candide,Welsh National Opera: Candide,22 – 24 June 2023,Thu 22 Jun – Sat 24 Jun,,2023-06-22,2023-06-24,,"Wales Millennium Centre, Bute Place, Cardiff, CF10 5AL",Cardiff,Wales Millennium Centre,CF10 5AL,Cardiff,cff,Wales Millennium Centre  Bute Place  Cardiff  CF10 5AL,performance,"CandideBernsteinThe Best of all Possible WorldsLeonard Bernstein's Candide is a supercharged wild ride in which 18th-century France crashes into 20th-century post-war America. Take a seat and strap in tight for a mind-boggling journey as we hurtle through a fantastical world of chaos – from castles in the Alps to skyscrapers in Montevideo, from earthquakes in Lisbon to the Amazonian jungles beyond the Andes. With societies riven by inequality and families displaced by war today, the story remain...",Wales Millenium Centre,https://www.wmc.org.uk,./static/images/wmc_logo.png,109,05 Mar 2023 00:30
https://www.rctcbc.gov.uk//EN/Events/Archive/2023/June/TeddyBears'Picnic.aspx,Teddy Bears' Picnic,Friday 23 June 2023,Fri 23 Jun,,2023-06-23,2023-06-23,,Ynysangharad War Memorial Park,Pontypridd,Ynysangharad War Memorial Park,CF37 4PD,Rhondda Cynon Taf,rct,Ynysangharad War Memorial Park  Pontypridd  CF37 4PD,event,"Aimed at those aged five and under – plus their parents or carers – the Teddy Bears' Picnic is the perfect place to find out more about the many services and opportunities on offer for children and families – from inspiring young bookworms via the library service to how to access childcare, healthcare and more. Each of the stalls offer information that is specifically for the families and carers of those aged five and under, with interactive and practical activities to showcase the work they do....",Rhondda Cynon Taf,https://www.rctcbc.gov.uk/,./static/images/rct_logo.png,110,05 Mar 2023 00:30
https://www.rctcbc.gov.uk//EN/Events/Archive/2023/June/ClassicCarShow.aspx,Classic Car Show,Saturday 24 June 2023,Sat 24 Jun,,2023-06-24,2023-06-24,,Rhondda Heritage Park,Trehafod,Rhondda Heritage Park,CF37 2NP,Rhondda Cynon Taf,rct,Rhondda Heritage Park  Coedcae Rd  South Wales CF37 2NP,event,"One for all the Classic Car enthusiasts! The popular, annual car show returns to A Welsh Coal Mining Experience at Rhondda Heritage Park Museum on 24th June. More info to be announced soon!",Rhondda Cynon Taf,https://www.rctcbc.gov.uk/,./static/images/rct_logo.png,111,05 Mar 2023 00:30
https://cadw.gov.wales/criccieth-castle-guided-tour,Criccieth Castle Guided Tour,Sun 25 Jun 2023,Sun 25 Jun,,2023-06-25,2023-06-25,,Criccieth Castle,Criccieth,Criccieth Castle,LL52 0DP,Gwynedd,out,Criccieth Castle  LL52 0DP,event,"Tour the castle that was originally built by Llywellyn the Great and reveal its secrets. The castle changed hands between the Welsh and the English regularly; can you imagine how dangerous and unstable the medieval times were as war cast a constant shadow on the inhabitants. Step back in time as we follow in the footsteps of the Welsh soldiers that tried to capture the castle. Blood and dignity, passion and grandeur, all were prominent in the history of the thirteenth century. Then step into the...",Cadw,https://cadw.gov.wales/ ,./static/images/cadw_logo.png,112,05 Mar 2023 00:30
https://www.cardiffcastle.com/events/rag-n-bone-man/,Rag 'N' Bone Man,25                             Jun                             2023,Sun 25 Jun,,2023-06-25,2023-06-25,,"Cardiff Castle, Castle Street, Cardiff CF10 3RB",Cardiff,Cardiff Castle,CF10 3RB,Cardiff,cff,Cardiff Castle  Castle Street  Cardiff CF10 3RB,event,Triple BRIT Award winner Rag‘N'Bone Man has announced a huge headline show at Cardiff Castle on Sunday 25 June 2023.,Cardiff Castle,https://www.cardiffcastle.com/ ,./static/images/cardiff_castle_logo.png,112,05 Mar 2023 00:30
https://www.cardiffcastle.com/events/the-chicks/,The Chicks,27                             Jun                             2023,Tue 27 Jun,,2023-06-27,2023-06-27,,"The Castle Green, Cardiff Castle, Castle Street, Cardiff, CF10 3RB",Cardiff,The Castle Green,CF10 3RB,Cardiff,cff,The Castle Green  Cardiff Castle  Castle Street  Cardiff  CF10 3RB,event,"Fresh off the heels of their massively successful U.S. tour last summer, the 13-time GRAMMY award-winning, multi-platinum selling global superstars, The Chicks today announced their return to the global stage with The Chicks 2023 World Tour – and it includes a headline date at Cardiff Castle.",Cardiff Castle,https://www.cardiffcastle.com/ ,./static/images/cardiff_castle_logo.png,114,05 Mar 2023 00:30
https://www.wmc.org.uk/en/whats-on/2023/greatest-days,Greatest Days,27 June – 1 July 2023,Tue 27 Jun – Sat 01 Jul,,2023-06-27,2023-07-01,,"Wales Millennium Centre, Bute Place, Cardiff, CF10 5AL",Cardiff,Wales Millennium Centre,CF10 5AL,Cardiff,cff,Wales Millennium Centre  Bute Place  Cardiff  CF10 5AL,performance,"Relight Your Fire with this sensational new production of Take That's smash hit musical Greatest Days.Greatest Days features more than 15 record-breaking Take That songs, alongside a heart-warming and hilarious story of love, loss and laughter from award-winning writer Tim Firth that will make your heart Shine.",Wales Millenium Centre,https://www.wmc.org.uk,./static/images/wmc_logo.png,114,05 Mar 2023 00:30
https://www.cardiffcastle.com/events/glitterbox/,Glitterbox,01                             Jul                             2023,Sat 01 Jul,,2023-07-01,2023-07-01,July,"The Castle Green, Cardiff Castle, Castle Street, Cardiff, CF10 3RB",Cardiff,The Castle Green,CF10 3RB,Cardiff,cff,The Castle Green  Cardiff Castle  Castle Street  Cardiff  CF10 3RB,event,"Glitterbox is playing live at Cardiff Castle on Saturday 01 July 2023, tickets on general sale from Friday 24 February @ 10:00.",Cardiff Castle,https://www.cardiffcastle.com/ ,./static/images/cardiff_castle_logo.png,118,05 Mar 2023 00:30
https://cadw.gov.wales/knights-school,Knights School,Sat 01 Jul                             - Sun 02 Jul 2023,Sat 01 Jul - Sun 02 Jul,,2023-07-01,2023-07-02,,Beaumaris Castle,Beaumaris,Beaumaris Castle,LL58 8AP,Isle of Anglesey,out,Beaumaris Castle  LL58 8AP,event,"Come and join the Beaumaris Castle Knights School! Beaumaris Castle will hold a Knights School this weekend where children can train and learn the techniques of battle. Adults can join in too and learn some basic skills using a sword. There will also be talks and displays on armour, weapons and archery.   How to visit",Cadw,https://cadw.gov.wales/ ,./static/images/cadw_logo.png,118,05 Mar 2023 00:30
http://www.margamcountrypark.co.uk//2128?event_id=38657,The Glamorgan Iron Horse Vintage Society Display Of Tractors,Sat 01 Jul 2023,Sat 01 Jul - Sun 02 Jul,,2023-07-01,2023-07-01,,"Margam Country Park, Margam, Port Talbot, SA13 2TJ ",Margam,Margam Country Park,SA13 2TJ,Neath Port Talbot,oth,Margam Country Park  Margam  Port Talbot  SA13 2TJ ,event,Discover a huge range and variety of unusual tractors and vintage farm machinery and talk to the experts.,Margam Park,http://www.margamcountrypark.co.uk/,./static/images/margam_logo.png,118,05 Mar 2023 00:30
https://www.cardiffcastle.com/events/sting/,Sting,02                             Jul                             2023,Sun 02 Jul,,2023-07-02,2023-07-02,,"The Castle Green, Cardiff Castle, Castle Street, Cardiff, CF10 3RB",Cardiff,The Castle Green,CF10 3RB,Cardiff,cff,The Castle Green  Cardiff Castle  Castle Street  Cardiff  CF10 3RB,event,"Sting is bringing his My Songs 2023 tour to Cardiff Castle, live on Sun 2 July 2023. Presented by DEPOT Live.",Cardiff Castle,https://www.cardiffcastle.com/ ,./static/images/cardiff_castle_logo.png,119,05 Mar 2023 00:30
https://www.wmc.org.uk/en/whats-on/2023/annie,Annie,3 – 8 July 2023,Mon 03 Jul – Sat 08 Jul,,2023-07-03,2023-07-08,,"Wales Millennium Centre, Bute Place, Cardiff, CF10 5AL",Cardiff,Wales Millennium Centre,CF10 5AL,Cardiff,cff,Wales Millennium Centre  Bute Place  Cardiff  CF10 5AL,performance,"The smash-hit production of Annie comes to Cardiff, direct from London's West End. This ‘glorious revival' (The Times) stars Strictly Come Dancing judge Craig Revel Horwood as the tyrannical Miss Hannigan!",Wales Millenium Centre,https://www.wmc.org.uk,./static/images/wmc_logo.png,120,05 Mar 2023 00:30
https://www.cardiffcastle.com/events/the-lumineers/,The Lumineers,07                             Jul                             2023,Fri 07 Jul,,2023-07-07,2023-07-07,,"The Castle Green, Cardiff Castle, Castle Street, Cardiff, CF10 3RB",Cardiff,The Castle Green,CF10 3RB,Cardiff,cff,The Castle Green  Cardiff Castle  Castle Street  Cardiff  CF10 3RB,event,"The Lumineers bring their Brightside World Tour to Cardiff Castle, live on Fri 7 July 2023. Presented by DEPOT Live.",Cardiff Castle,https://www.cardiffcastle.com/ ,./static/images/cardiff_castle_logo.png,124,05 Mar 2023 00:30
https://cadw.gov.wales/lets-discover-medieval-food,Let's Discover ... Medieval Food,Sat 08 Jul                             - Sun 09 Jul 2023,Sat 08 Jul - Sun 09 Jul,,2023-07-08,2023-07-09,,Chepstow Castle,Chepstow,Chepstow Castle,NP16 5EY,Monmouthshire,oth,Chepstow Castle  Bridge St  Chepstow NP16 5EY ,event,"Discover what the medieval residents of Chepstow Castle would have eaten, especially around feast days. With a display of ingredients, food and utensils, in progress preparation of bread dough and spice mix for gingerbread, children will be able to use fake food to assemble ingredients for the cauldron of pottage and set the table for a noble visitor to the castle.   How to visit",Cadw,https://cadw.gov.wales/ ,./static/images/cadw_logo.png,125,05 Mar 2023 00:30
http://www.margamcountrypark.co.uk//2128?event_id=38658,Barrio Fiesta Sa Wales 2023,Sat 08 Jul 2023,Sat 08 Jul - Sun 09 Jul,,2023-07-08,2023-07-08,,"Margam Country Park, Margam, Port Talbot, SA13 2TJ ",Margam,Margam Country Park,SA13 2TJ,Neath Port Talbot,oth,Margam Country Park  Margam  Port Talbot  SA13 2TJ ,event,"Barrio Fiesta sa Wales 2023 organized by Filipinos in Wales. Witness our cultural, food, music and dance showcase. It's full of surprises and fun!! You will enjoy your day😊🎉🎉",Margam Park,http://www.margamcountrypark.co.uk/,./static/images/margam_logo.png,125,05 Mar 2023 00:30
https://www.cardiffcastle.com/events/depot-in-the-castle-bastille/,Depot In The Castle - Bastille,08                             Jul                             2023,Sat 08 Jul,,2023-07-08,2023-07-08,,"The Castle Green, Cardiff Castle, Castle Street, Cardiff, CF10 3RB",Cardiff,The Castle Green,CF10 3RB,Cardiff,cff,The Castle Green  Cardiff Castle  Castle Street  Cardiff  CF10 3RB,event,"Now in its sixth year, DEPOT in the Castle is Cardiff’s annual festival, based in the incredible surroundings of the iconic, city-centre castle grounds; headliners over the years have included Kaiser Chiefs, Tom Grennan, Ella Eyre, Clean Bandit and The Fratellis – and are excited to announce Bastille as the headliner for DEPOT in the Castle 2023.",Cardiff Castle,https://www.cardiffcastle.com/ ,./static/images/cardiff_castle_logo.png,125,05 Mar 2023 00:30
http://www.margamcountrypark.co.uk//2128?event_id=38659,Step Back In Time With Medieval Knights And Archers From The Lions And Lilies Group,Sat 15 Jul 2023,Sat 15 Jul - Sun 16 Jul,,2023-07-15,2023-07-15,,"Margam Country Park, Margam, Port Talbot, SA13 2TJ ",Margam,Margam Country Park,SA13 2TJ,Neath Port Talbot,oth,Margam Country Park  Margam  Port Talbot  SA13 2TJ ,event,"A weekend of archery, combat and sword demonstrations. Ask questions, learn how to handle a pike and try on armour, learn about handicrafts and the food of the era. Great fun day out.",Margam Park,http://www.margamcountrypark.co.uk/,./static/images/margam_logo.png,132,05 Mar 2023 00:30
https://www.cardiffcastle.com/events/tom-jones/,Tom Jones,21                             Jul                             2023,Fri 21 Jul - Mon 24 Jul,,2023-07-21,2023-07-21,,"The Castle Green, Cardiff Castle, Castle Street, Cardiff, CF10 3RB",Cardiff,The Castle Green,CF10 3RB,Cardiff,cff,The Castle Green  Cardiff Castle  Castle Street  Cardiff  CF10 3RB,event,"Tom Jones is playing live at Cardiff Castle on Friday 21 July 2023, tickets on general sale from Friday 10 February @ 10:00.",Cardiff Castle,https://www.cardiffcastle.com/ ,./static/images/cardiff_castle_logo.png,138,05 Mar 2023 00:30
https://cadw.gov.wales/freemen-gwent-1,The Freemen Of Gwent,Sat 22 Jul                             - Sun 23 Jul 2023,Sat 22 Jul - Sun 23 Jul,,2023-07-22,2023-07-23,,St Davids Bishop's Palace,St. Davids,St Davids Bishop's Palace,SA62 6PE,Pembrokeshire,out,St Davids Bishop's Palace  SA62 6PE,event,"The year is 1416, and the Freemen of Gwent have returned from France where they fought victoriously under King Henry V's banner at Agincourt the previous year. However, they feel the need to atone for their sins to save themselves from dire retribution, and what better place to achieve this than at St Davids Bishop's Palace.",Cadw,https://cadw.gov.wales/ ,./static/images/cadw_logo.png,139,05 Mar 2023 00:30
https://cadw.gov.wales/living-history-weekend-1,Living History Weekend,Sat 22 Jul                             - Sun 23 Jul 2023,Sat 22 Jul - Sun 23 Jul,,2023-07-22,2023-07-23,,Valle Crucis Abbey,Llantysilio,Valle Crucis Abbey,LL20 8DD,Denbighshire,out,Valle Crucis Abbey  LL20 8DD,event,"Join us for a day filled with historical fun and medieval activities! Watch as experienced falconers fly their majestic birds, and see the birds swoop over your heads.  Listen to skilled musicians in the Dormitory, as they play their medieval instruments.  Experience the thrill of the fight with a medieval re-enactment, and discover how our ancestors lived and fought through the middle ages.",Cadw,https://cadw.gov.wales/ ,./static/images/cadw_logo.png,139,05 Mar 2023 00:30
http://www.margamcountrypark.co.uk//2128?event_id=38660,Summer Pruning,Sat 22 Jul 2023,Sat 22 Jul,,2023-07-22,2023-07-22,,"Margam Country Park, Margam, Port Talbot, SA13 2TJ ",Margam,Margam Country Park,SA13 2TJ,Neath Port Talbot,oth,Margam Country Park  Margam  Port Talbot  SA13 2TJ ,event,"Join in with the summer pruning of the espalier pear trees in the Community Orchard. Includes hands on, practical demonstrations. 10am-12pm and 1pm-3pm. Booking is essential. Free, parking charges apply.",Margam Park,http://www.margamcountrypark.co.uk/,./static/images/margam_logo.png,139,05 Mar 2023 00:30
https://cadw.gov.wales/summer-trail,Summer Trail,Sat 22 Jul                             - Thu 31 Aug 2023,Sat 22 Jul - Thu 31 Aug,,2023-07-22,2023-08-31,,Caerleon Roman Fortress and Baths,Caerleon,Caerleon Roman Fortress and Baths,NP18 1AE,Newport,oth,Caerleon Roman Fortress and Baths  NP18 1AE,event,"Come and take part in our Roman Baths Treasure Hunt! Personal valuables often went missing during a visit to the Baths, leaving a treasure trove of unusual objects, hidden for almost 2000 years.  Explore the Baths and find the lost treasures!   How to visit",Cadw,https://cadw.gov.wales/ ,./static/images/cadw_logo.png,139,05 Mar 2023 00:30
https://cadw.gov.wales/ardudwy-knights,Ardudwy Knights,Sat 22 Jul                             - Sun 23 Jul 2023,Sat 22 Jul - Sun 23 Jul,,2023-07-22,2023-07-23,,Harlech Castle,Harlech,Harlech LL46 2YH , LL46 2YH ,Gwynedd,out,Harlech LL46 2YH ,event,What was it like to live in Harlech Castle in the 13th Century? Step back in time and watch the Ardudwy knights: with weaponry demonstrations and combat displays.   How to visit •    purchase your admission tickets on arrival (or book online)* •    check event times and prices below,Cadw,https://cadw.gov.wales/ ,./static/images/cadw_logo.png,139,05 Mar 2023 00:30
https://cadw.gov.wales/lets-discover-medieval-weapons,Let's Discover… Medieval Weapons,Tue 25 Jul 2023,Tue 25 Jul,,2023-07-25,2023-07-25,,Chepstow Castle,Chepstow,Chepstow Castle,NP16 5EY,Monmouthshire,oth,Chepstow Castle  Bridge St  Chepstow NP16 5EY ,event,"Come and be entertained by our resident knight, and get a close-up look at medieval weaponry!  Talks and demonstrations throughout the day. Everything you wanted to know but were too afraid to ask!   How to visit •    purchase your admission tickets on arrival (or book online)* •    check event times and prices below",Cadw,https://cadw.gov.wales/ ,./static/images/cadw_logo.png,142,05 Mar 2023 00:30
https://cadw.gov.wales/knight-school,Knight School,Tue 25 Jul 2023,Tue 25 Jul,,2023-07-25,2023-07-25,,Harlech Castle,Harlech,Harlech LL46 2YH , LL46 2YH ,Gwynedd,out,Harlech LL46 2YH ,event,"Wanted: children to train as loyal knights of Harlech Castle! Do you have what it takes to be a successful knight? Full training given; report to Harlech Castle.  Every Tuesday during the school holidays. Please note: activity is suitable for over 5's only limited spaces, operating on a first come basis spaces are unable to be booked.",Cadw,https://cadw.gov.wales/ ,./static/images/cadw_logo.png,142,05 Mar 2023 00:30
https://cadw.gov.wales/falconry-days,Falconry Days,Wed 26 Jul 2023,Wed 26 Jul,,2023-07-26,2023-07-26,,Raglan Castle,Raglan,Raglan Castle,NP15 2BT,Monmouthshire,oth,Raglan Castle  Castle Rd  Raglan NP15 2BT ,event,Wings of Wales join us again with their birds of prey! Come and meet the birds and enjoy their flying displays.   How to visit •    purchase your admission tickets on arrival (or book online)* •    check event times and prices below,Cadw,https://cadw.gov.wales/ ,./static/images/cadw_logo.png,143,05 Mar 2023 00:30
https://cadw.gov.wales/excavating-medieval-castell-coch-a-victorian-expedition,Excavating Medieval Castell Coch: A Victorian Expedition,Sat 29 Jul                             - Sun 30 Jul 2023,Sat 29 Jul - Sun 30 Jul,,2023-07-29,2023-07-30,,Castell Coch,Cardiff,Castell Coch,CF15 7JS,Cardiff,cff,Castell Coch  Cardiff CF15 7JS ,event,"Castell Coch is a Victorian rebuild in its upper levels, whilst being on Medieval lower levels and foundations. Before this re-build took place a series of archaeological excavations were conducted by a G.T.Clark, whose work was published in 1850. Join us in reconstructing the Victorian excavations here of the 1800s. Uncover with your own hands a range of Medieval treasures, try and guess what it is you have found! Learn to record these items, in their archaeological context and practice these m...",Cadw,https://cadw.gov.wales/ ,./static/images/cadw_logo.png,146,05 Mar 2023 00:30
https://www.wmc.org.uk/en/whats-on/2023/winnie-the-pooh,Winnie The Pooh,3 – 5 August 2023,Thu 03 Aug – Sat 05 Aug,,2023-08-03,2023-08-05,August,"Wales Millennium Centre, Bute Place, Cardiff, CF10 5AL",Cardiff,Wales Millennium Centre,CF10 5AL,Cardiff,cff,Wales Millennium Centre  Bute Place  Cardiff  CF10 5AL,performance,"Disney's iconic Winnie the Pooh, Christopher Robin and their best friends Piglet, Eeyore, Kanga, Roo, Rabbit, and Owl (oh... and don't forget Tigger too!) have come to life in a beautifully crafted musical stage adaptation.",Wales Millenium Centre,https://www.wmc.org.uk,./static/images/wmc_logo.png,151,05 Mar 2023 00:30
https://www.rctcbc.gov.uk//EN/Events/Archive/2023/August/TheBigWelshBite.aspx,The Big Welsh Bite,Saturday 5 - Sunday 6 August 2023,Sat 05 Aug - Sun 06 Aug,,2023-08-05,2023-08-06,,Ynysangharad War Memorial Park,Pontypridd,Ynysangharad War Memorial Park,CF37 4PD,Rhondda Cynon Taf,rct,Ynysangharad War Memorial Park  Pontypridd  CF37 4PD,event,"It's the BIG event of the season! 2 whole days of food and fun in Ynysangharad War Memorial Park, Pontypridd.  Taking place on 5th and 6th August, this year's event will have food galore!  More info to be announced soon. Sponsored by Nathaniel Cars",Rhondda Cynon Taf,https://www.rctcbc.gov.uk/,./static/images/rct_logo.png,153,05 Mar 2023 00:30
